{
  "schema_version": "xintel.candidate.v1",
  "candidate_id": "20e95639-c11e-4931-8ee8-68beadaef0ae",
  "first_seen_at": "2026-09-20T19:30:26Z",
  "contract_address": "EKtmPPLaCbEEKiwoHHtV7TsRsmPXs5CMGtQtZFSiinsc",
  "chain": "solana",
  "ticker": "STAMP",
  "mc_usd_at_first_sight": 2850000,
  "price_usd_at_first_sight": 0.0028,
  "decision": "watch",
  "reject_reason": null,
  "evidence": [
    {
      "channel": "x_social",
      "summary": "ZEC/privacy heat hitch; Grok Bot WATCH (mid-cap + dumping)",
      "observed_at": "2026-09-20T19:30:26Z"
    },
    {
      "channel": "narrative",
      "summary": "6/10 privacy meta rider, late/exhaustion risk; watch only",
      "observed_at": "2026-09-20T19:30:26Z"
    },
    {
      "channel": "launch_metrics",
      "summary": "MC ~$2.8\u20132.9M; top liq ~$200k PumpSwap/ZEC + ~$290k Meteora/SOL; ~$5.7M vol; 5m \u221226% to \u221229%; pair age hours",
      "observed_at": "2026-09-20T19:30:26Z"
    },
    {
      "channel": "onchain_flow",
      "summary": "Pump.fun create ~11:25 PT \u2192 PumpSwap grad ~11:44 PT; Token-2022 mint/freeze revoked. Creator 26oK69\u2026 serial Pump deployer (5+ prior low-MC). Rugcheck insiders 8 (2\u00d74 transfer clusters). Liq STAMP/ZEC ~$174k + STAMP/SOL ~$135k; thin satellites. Full early-buyer list RPC-limited. Flow: WATCH \u2014 serial deployer + insider graph risk; no escalate.",
      "observed_at": "2026-09-20T19:31:00Z",
      "refs": [
        "creator:26oK69pYx7R25ULts9hLYF2HpTnZ421jPYMPsds9GtYA"
      ],
      "weight": 0.7
    }
  ],
  "source_accounts": [],
  "experiment_id": "xintel_v0",
  "outcomes": {
    "ret_5m": null,
    "ret_15m": null,
    "ret_1h": null,
    "ret_6h": null,
    "ret_24h": null,
    "max_runup": null,
    "max_drawdown": null
  },
  "feature_scores": {
    "schema_version": "xintel.feature_scores.v1",
    "experiment_id": "xintel_v0",
    "batch": "BATCH_01",
    "provisional": true,
    "scored_at": "2026-09-20T19:31:00Z",
    "scored_by": "Outcome Desk backfill + Flow/Narrative room evidence",
    "scores": {
      "D1": {
        "feature_id": "D1",
        "value": null,
        "direction": "bearish",
        "provisional": true,
        "batch": "BATCH_01",
        "desk": "Flow",
        "notes": "Rugcheck insiders 8 (2x4 transfer clusters) + serial deployer noted; not clear Bubblemaps-style sybil-bundled funnel at T \u2014 leave null.",
        "observed_at": "2026-09-20T19:31:00Z"
      },
      "S2": {
        "feature_id": "S2",
        "value": null,
        "direction": "bullish",
        "provisional": true,
        "batch": "BATCH_01",
        "desk": "Narrative",
        "notes": null,
        "observed_at": null
      },
      "S3": {
        "feature_id": "S3",
        "value": null,
        "direction": "bullish",
        "provisional": true,
        "batch": "BATCH_01",
        "desk": "X Scout",
        "notes": null,
        "observed_at": null
      },
      "S4": {
        "feature_id": "S4",
        "value": "hours",
        "direction": "context",
        "provisional": true,
        "batch": "BATCH_01",
        "desk": "Market",
        "notes": "Pair age hours at first_seen (launch ~11:25 PT \u2192 seen ~12:30 PT band).",
        "observed_at": "2026-09-20T19:30:26Z"
      },
      "D2": {
        "feature_id": "D2",
        "value": false,
        "direction": "bearish",
        "provisional": true,
        "batch": "BATCH_01",
        "desk": "Narrative",
        "notes": "ZEC/privacy heat hitch / meta rider \u2014 not an explicit post-leader copycat of a category-leader coin.",
        "observed_at": "2026-09-20T19:30:26Z"
      },
      "S5": {
        "feature_id": "S5",
        "value": true,
        "direction": "bullish",
        "provisional": true,
        "batch": "BATCH_01",
        "desk": "Flow",
        "notes": "Token-2022 mint/freeze revoked at T (Flow). LP burn / CTO not claimed; weak-alone feature.",
        "observed_at": "2026-09-20T19:31:00Z"
      },
      "D4": {
        "feature_id": "D4",
        "value": null,
        "direction": "bearish",
        "provisional": true,
        "batch": "BATCH_01",
        "desk": "Market",
        "notes": null,
        "observed_at": null
      },
      "S1": {
        "feature_id": "S1",
        "value": null,
        "direction": "context",
        "provisional": true,
        "batch": "BATCH_01",
        "desk": "Narrative",
        "notes": null,
        "observed_at": null
      }
    }
  }
}
