{
  "schema_version": "xintel.candidate.v1",
  "candidate_id": "41e00d97-c57d-4ab3-be9b-47686a17f906",
  "first_seen_at": "2026-09-20T19:30:26Z",
  "contract_address": "0x95b643D0f281016e4E8E22111f0cB1676C73eFC6",
  "chain": "bsc",
  "ticker": "SNOWBOARD",
  "mc_usd_at_first_sight": 2800,
  "price_usd_at_first_sight": null,
  "decision": "reject",
  "reject_reason": "Tiny acct, thin story; narrative 2/10; Market Check skip",
  "evidence": [
    {
      "channel": "x_social",
      "summary": "Tiny acct ~2.8k MC claim",
      "observed_at": "2026-09-20T19:30:26Z"
    },
    {
      "channel": "narrative",
      "summary": "2/10 \u2014 skip",
      "observed_at": "2026-09-20T19:30:26Z"
    }
  ],
  "source_accounts": [],
  "experiment_id": "xintel_v0",
  "outcomes": {
    "ret_5m": null,
    "ret_15m": null,
    "ret_1h": null,
    "ret_6h": null,
    "ret_24h": null,
    "max_runup": null,
    "max_drawdown": null
  },
  "feature_scores": {
    "schema_version": "xintel.feature_scores.v1",
    "experiment_id": "xintel_v0",
    "batch": "BATCH_01",
    "provisional": true,
    "scored_at": "2026-09-20T19:35:00Z",
    "scored_by": "Outcome Desk stub \u2014 insufficient room evidence",
    "scores": {
      "D1": {
        "feature_id": "D1",
        "value": null,
        "direction": "bearish",
        "provisional": true,
        "batch": "BATCH_01",
        "desk": "Flow",
        "notes": null,
        "observed_at": null
      },
      "S2": {
        "feature_id": "S2",
        "value": null,
        "direction": "bullish",
        "provisional": true,
        "batch": "BATCH_01",
        "desk": "Narrative",
        "notes": null,
        "observed_at": null
      },
      "S3": {
        "feature_id": "S3",
        "value": null,
        "direction": "bullish",
        "provisional": true,
        "batch": "BATCH_01",
        "desk": "X Scout",
        "notes": null,
        "observed_at": null
      },
      "S4": {
        "feature_id": "S4",
        "value": null,
        "direction": "context",
        "provisional": true,
        "batch": "BATCH_01",
        "desk": "Market",
        "notes": null,
        "observed_at": null
      },
      "D2": {
        "feature_id": "D2",
        "value": null,
        "direction": "bearish",
        "provisional": true,
        "batch": "BATCH_01",
        "desk": "Narrative",
        "notes": null,
        "observed_at": null
      },
      "S5": {
        "feature_id": "S5",
        "value": null,
        "direction": "bullish",
        "provisional": true,
        "batch": "BATCH_01",
        "desk": "Flow",
        "notes": null,
        "observed_at": null
      },
      "D4": {
        "feature_id": "D4",
        "value": null,
        "direction": "bearish",
        "provisional": true,
        "batch": "BATCH_01",
        "desk": "Market",
        "notes": null,
        "observed_at": null
      },
      "S1": {
        "feature_id": "S1",
        "value": null,
        "direction": "context",
        "provisional": true,
        "batch": "BATCH_01",
        "desk": "Narrative",
        "notes": null,
        "observed_at": null
      }
    }
  }
}
